{"$id":"https://closy.local/schemas/v1/closy-integrated-representation-invalidation-ledger-d0-v1.schema.json","$schema":"https://json-schema.org/draft/2020-12/schema","additionalProperties":false,"properties":{"baselineIdentities":{"additionalProperties":{"pattern":"^[0-9a-f]{64}$","type":"string"},"maxProperties":15,"minProperties":15,"type":"object"},"calculatedInvalidation":{"additionalProperties":false,"properties":{"changedIdentityClasses":{"items":{"type":"string"},"type":"array"},"failClosed":{"const":true},"invalidatedCapabilities":{"items":{"type":"string"},"type":"array"},"mandatoryReruns":{"items":{"type":"string"},"type":"array"},"retainedByExactIdentity":{"items":{"type":"string"},"type":"array"}},"required":["changedIdentityClasses","invalidatedCapabilities","retainedByExactIdentity","mandatoryReruns","failClosed"],"type":"object"},"currentIdentities":{"additionalProperties":{"pattern":"^[0-9a-f]{64}$","type":"string"},"maxProperties":15,"minProperties":15,"type":"object"},"dependencyRules":{"type":"object"},"ledgerVersion":{"const":"closy.integrated-representation-invalidation-ledger.d0.v1"},"schemaVersion":{"const":1}},"required":["schemaVersion","ledgerVersion","baselineIdentities","currentIdentities","dependencyRules","calculatedInvalidation"],"title":"Closy integrated representation invalidation ledger D0 v1","type":"object"}
