{"baselineIdentities":{"avatarAuthorityHash":"93dede16258c6de30e29dfb02a108b211784c2526a1c7a70311aef99395f4cce","avatarFitDigest":"d470fcbedac9bed9adfc29058db590f850d9880edb748f931446c78371021b16","bindingHash":"7331f0210a0c00e7cc32909809e99a7c92504a717fa0013e270acca66b6ef25f","canonicalPackageDigest":"836abc564a79c0f38ae8bdad3d4a418b0fb05a550193059c1cece8130203c20a","conventionalFallbackHash":"8eccea814251f8974f5349548038be73a4d00cec73df7a7bfb787aede58385c6","dynamicOutputIdentity":"996b50ed90946f1c01afe9bf450060008547b5db4fd2ba66902bf9ddf6e80217","dynamicRequestIdentity":"38fadbc2b08bddb83a6dff0d2c086070ebf22c715767b847d08bff1d2431e3ca","layerProfileIdentity":"5fa3db9f770d495f38dc8afc4410c8feed2bf1ec189d648a17383ddda95d1b93","mechanicalReferenceSurfaceHash":"2be42dedf78136676b963c8a9a9a4c791ac36f6de8c9b0adb0730b6f41624b81","outfitSurfaceIdentity":"59dada5943fe282c96a88f6307b86df20ad40ee678be4222a035126d7d07b904","patternHash":"e476864cbd1434831e66008f151585f3feebbd7299b209bdb8accc308e6fd207","renderTopologyHash":"f5bf0dbbdb69239833784b2cbc072b1bed740a3bb19de2ae7d3f05d19dbe6e26","simulationTopologyHash":"4e5195d12e5f93579c5f97acb8716ff1e4b6fdbb2b885c434e57edbf3feb179c","staticDerivativeIdentity":"5d91c577c6f644681bd748eccceec7aae31a2bd39deeb992880a540fa78cf137","zeroOneBinaryIdentity":"b29345b062691cfa7d7e6873c7c9b9bca2cd5a46e670b866d8e69153c0ad8476"},"calculatedInvalidation":{"changedIdentityClasses":[],"failClosed":true,"invalidatedCapabilities":[],"mandatoryReruns":[],"retainedByExactIdentity":["candidate_static_zeroone","conventional_c3_deformation","conventional_static_fallback","geometric_layer_collision_d0","mt1_reference_motion_d0","synthetic_avatar_fit_d0"]},"currentIdentities":{"avatarAuthorityHash":"93dede16258c6de30e29dfb02a108b211784c2526a1c7a70311aef99395f4cce","avatarFitDigest":"d470fcbedac9bed9adfc29058db590f850d9880edb748f931446c78371021b16","bindingHash":"7331f0210a0c00e7cc32909809e99a7c92504a717fa0013e270acca66b6ef25f","canonicalPackageDigest":"836abc564a79c0f38ae8bdad3d4a418b0fb05a550193059c1cece8130203c20a","conventionalFallbackHash":"8eccea814251f8974f5349548038be73a4d00cec73df7a7bfb787aede58385c6","dynamicOutputIdentity":"996b50ed90946f1c01afe9bf450060008547b5db4fd2ba66902bf9ddf6e80217","dynamicRequestIdentity":"38fadbc2b08bddb83a6dff0d2c086070ebf22c715767b847d08bff1d2431e3ca","layerProfileIdentity":"5fa3db9f770d495f38dc8afc4410c8feed2bf1ec189d648a17383ddda95d1b93","mechanicalReferenceSurfaceHash":"2be42dedf78136676b963c8a9a9a4c791ac36f6de8c9b0adb0730b6f41624b81","outfitSurfaceIdentity":"59dada5943fe282c96a88f6307b86df20ad40ee678be4222a035126d7d07b904","patternHash":"e476864cbd1434831e66008f151585f3feebbd7299b209bdb8accc308e6fd207","renderTopologyHash":"f5bf0dbbdb69239833784b2cbc072b1bed740a3bb19de2ae7d3f05d19dbe6e26","simulationTopologyHash":"4e5195d12e5f93579c5f97acb8716ff1e4b6fdbb2b885c434e57edbf3feb179c","staticDerivativeIdentity":"5d91c577c6f644681bd748eccceec7aae31a2bd39deeb992880a540fa78cf137","zeroOneBinaryIdentity":"b29345b062691cfa7d7e6873c7c9b9bca2cd5a46e670b866d8e69153c0ad8476"},"dependencyRules":{"candidate_static_zeroone":["canonicalPackageDigest","conventionalFallbackHash","mechanicalReferenceSurfaceHash","staticDerivativeIdentity","zeroOneBinaryIdentity"],"conventional_c3_deformation":["bindingHash","canonicalPackageDigest","renderTopologyHash","simulationTopologyHash"],"conventional_static_fallback":["canonicalPackageDigest","conventionalFallbackHash"],"geometric_layer_collision_d0":["avatarAuthorityHash","avatarFitDigest","layerProfileIdentity","outfitSurfaceIdentity","renderTopologyHash","simulationTopologyHash"],"mt1_reference_motion_d0":["bindingHash","dynamicOutputIdentity","dynamicRequestIdentity","mechanicalReferenceSurfaceHash","renderTopologyHash","simulationTopologyHash","staticDerivativeIdentity","zeroOneBinaryIdentity"],"synthetic_avatar_fit_d0":["avatarAuthorityHash","avatarFitDigest"]},"ledgerVersion":"closy.integrated-representation-invalidation-ledger.d0.v1","schemaVersion":1}
